{"schema":"chancadem.readiness/v1","product_version":"0.09.003","catalog_sha256":"3de5f5ef24152b67b7581965614ed525c2c2296981e470efcfdf2ef12427122f","contracts":[{"id":"params-record","version":"1.0.0","status":"real","provenance":"real","state":"available","reason":null,"missing":[]},{"id":"hp500-survey","version":"1.0.0","status":"real","provenance":"real","state":"available","reason":null,"missing":[]},{"id":"case-index","version":"1.0.0","status":"real","provenance":"real","state":"available","reason":null,"missing":[]},{"id":"case-manifest","version":"1.0.0","status":"real","provenance":"real","state":"available","reason":null,"missing":[]},{"id":"trace","version":"1.0.0","status":"real","provenance":"real","state":"available","reason":null,"missing":[]},{"id":"hp500-backbone","version":"1.0.0","status":"real","provenance":"real","state":"available","reason":null,"missing":[]},{"id":"hp500-loo","version":"1.0.0","status":"real","provenance":"real","state":"available","reason":null,"missing":[]},{"id":"surrogate-model","version":"1.0.0","status":"real","provenance":"real","state":"available","reason":null,"missing":[]},{"id":"anomaly-model","version":"1.0.0","status":"real","provenance":"real","state":"available","reason":null,"missing":[]},{"id":"model-metrics","version":"1.0.0","status":"real","provenance":"real","state":"stale","reason":{"en":"Baked by 0.10.000; the product is 0.09.003.","es":"Generado por 0.10.000; el producto es 0.09.003."},"missing":[]},{"id":"api","version":"1.0.1","status":"real","provenance":null,"state":"missing","reason":{"en":"The API lane is dormant; the site reads the committed documents.","es":"La API está inactiva; el sitio lee los documentos versionados."},"missing":[]}]}