{"schema":"chancadem.readiness/v1","product_version":"0.11.000","catalog_sha256":"2b6ba610b6e0045a5cb089fd9fdd2d5ce7c7ca06cc5dc56f99108c1d70bbba13","contracts":[{"id":"params-record","version":"1.0.0","status":"real","provenance":"fixture","state":"provider","reason":{"en":"Served by its provider (fixture:docs/contracts/fixtures/data/examples/params.csv); the real producer is not built yet.","es":"Lo sirve su proveedor (fixture:docs/contracts/fixtures/data/examples/params.csv); el productor real aún no está construido."},"missing":[]},{"id":"hp500-survey","version":"1.0.0","status":"real","provenance":"fixture","state":"provider","reason":{"en":"Served by its provider (fixture:docs/contracts/fixtures/data/examples/hp500-surveys.csv); the real producer is not built yet.","es":"Lo sirve su proveedor (fixture:docs/contracts/fixtures/data/examples/hp500-surveys.csv); el productor real aún no está construido."},"missing":[]},{"id":"case-index","version":"1.0.0","status":"real","provenance":"fixture","state":"provider","reason":{"en":"Served by its provider (fixture:docs/contracts/fixtures/data/derived/manifests/index.json); the real producer is not built yet.","es":"Lo sirve su proveedor (fixture:docs/contracts/fixtures/data/derived/manifests/index.json); el productor real aún no está construido."},"missing":[]},{"id":"case-manifest","version":"1.1.0","status":"real","provenance":"fixture","state":"provider","reason":{"en":"Served by its provider (fixture:docs/contracts/fixtures/data/derived/manifests/FX01.json); the real producer is not built yet.","es":"Lo sirve su proveedor (fixture:docs/contracts/fixtures/data/derived/manifests/FX01.json); el productor real aún no está construido."},"missing":[]},{"id":"trace","version":"1.0.0","status":"real","provenance":"fixture","state":"provider","reason":{"en":"Served by its provider (fixture:docs/contracts/fixtures/data/derived/FX01/trace.json); the real producer is not built yet.","es":"Lo sirve su proveedor (fixture:docs/contracts/fixtures/data/derived/FX01/trace.json); el productor real aún no está construido."},"missing":[]},{"id":"hp500-backbone","version":"1.0.0","status":"real","provenance":"fixture","state":"provider","reason":{"en":"Served by its provider (fixture:docs/contracts/fixtures/data/derived/hp500/backbone.json); the real producer is not built yet.","es":"Lo sirve su proveedor (fixture:docs/contracts/fixtures/data/derived/hp500/backbone.json); el productor real aún no está construido."},"missing":[]},{"id":"hp500-loo","version":"1.2.0","status":"real","provenance":"fixture","state":"provider","reason":{"en":"Served by its provider (fixture:docs/contracts/fixtures/data/derived/hp500/loo.json); the real producer is not built yet.","es":"Lo sirve su proveedor (fixture:docs/contracts/fixtures/data/derived/hp500/loo.json); el productor real aún no está construido."},"missing":[]},{"id":"hp500-crusherbayes","version":"1.0.0","status":"real","provenance":"fixture","state":"provider","reason":{"en":"Served by its provider (fixture:docs/contracts/fixtures/data/derived/hp500/crusherbayes.json); the real producer is not built yet.","es":"Lo sirve su proveedor (fixture:docs/contracts/fixtures/data/derived/hp500/crusherbayes.json); el productor real aún no está construido."},"missing":[]},{"id":"surrogate-model","version":"1.0.0","status":"real","provenance":"baseline","state":"provider","reason":{"en":"Served by its provider (baseline:data-pipeline/pipeline/model/crusher/engine.py); the real producer is not built yet.","es":"Lo sirve su proveedor (baseline:data-pipeline/pipeline/model/crusher/engine.py); el productor real aún no está construido."},"missing":[]},{"id":"anomaly-model","version":"1.0.0","status":"real","provenance":"baseline","state":"provider","reason":{"en":"Served by its provider (baseline:data-pipeline/pipeline/model/crusher/envelope.py); the real producer is not built yet.","es":"Lo sirve su proveedor (baseline:data-pipeline/pipeline/model/crusher/envelope.py); el productor real aún no está construido."},"missing":[]},{"id":"model-metrics","version":"1.0.0","status":"real","provenance":"fixture","state":"provider","reason":{"en":"Served by its provider (fixture:docs/contracts/fixtures/data/derived/model-metrics.json); the real producer is not built yet.","es":"Lo sirve su proveedor (fixture:docs/contracts/fixtures/data/derived/model-metrics.json); el productor real aún no está construido."},"missing":[]},{"id":"api","version":"1.0.1","status":"real","provenance":null,"state":"missing","reason":{"en":"The API lane is dormant; the site reads the committed documents.","es":"La API está inactiva; el sitio lee los documentos versionados."},"missing":[]}]}